{
  "ok": true,
  "capability": "Full",
  "capability_tier": "Full",
  "mode": "enforce",
  "engine_mode": "bpf_lsm",
  "kernel_version": "6.14.0-37-generic",
  "features": {
    "bpf_lsm": true,
    "cgroup_v2": true,
    "btf": true,
    "bpf_syscall": true,
    "ringbuf": true,
    "tracepoints": true,
    "bpffs": true,
    "ima": true,
    "ima_appraisal": true,
    "bpf_ima_helpers": true,
    "landlock": true,
    "ipe": true,
    "fs_verity": true,
    "bpf_token": true,
    "bpf_arena": true,
    "user_ringbuf": true,
    "sched_ext": true,
    "open_coded_iterators": true,
    "bpf_xattr_kfuncs": true,
    "bpf_send_signal_task": true,
    "binary_auth": true
  },
  "future_lsm": {
    "active_lsms": "lockdown,capability,landlock,yama,ipe,bpf,integrity",
    "landlock": true,
    "landlock_abi": 4,
    "ipe": true,
    "fs_verity": true,
    "bpf_token": true
  },
  "next_gen_bpf": {
    "arena": true,
    "user_ringbuf": true,
    "sched_ext": true,
    "open_coded_iterators": true,
    "xattr_kfuncs": true,
    "bpf_send_signal_task": true,
    "binary_auth": true
  },
  "checks": {
    "prereqs": true,
    "bpf_load": true,
    "required_maps": true,
    "layout_version": true,
    "required_pins": true,
    "network_pins": true,
    "bpf_object": true,
    "bpf_hash_verified": true
  },
  "bpf_object_path": "/usr/lib/aegisbpf/aegis.bpf.o",
  "bpf_object_found": true,
  "bpf_hash_found": true,
  "bpf_hash_verified": true,
  "allow_unsigned_bpf": false,
  "network_maps_present": true,
  "map_pressure": [
    {
      "name": "deny_inode_map",
      "entries": 0,
      "max": 65536,
      "utilization": 0.0
    }
  ]
}
